{"assignmentId":"preview-d8e7bffb76e814cf8fed232ed5817008d9291247f94d4e63bda6fbeb647daf33","attributions":[{"attributionText":"Draft original lesson by Exercise Book contributors. Not yet licensed for publication.","author":"Exercise Book contributors, Exercise Book curriculum review","licenseId":"LicenseRef-ExerciseBook-Draft","modifications":[],"publicationStatus":"draft","sourceUrl":"https://exercisebook.app/content/math/fractions/add-unlike-denominators","title":"Add fractions with unlike denominators"}],"content":[{"compilerVersion":"exercisebook-content-compiler/2","contentHash":"944225a2dda87ae6ee61e53f21a929301f5264793d665ea2200b65fb0f5a71dd","id":"math.fractions.add-unlike-denominators","revision":2,"sourceHash":"456c8908debd52c7fcc5eba6e2e9a38434b5fcd8343e7a14a427faae34502523"}],"expectedMinutes":12,"localStudyDate":"2026-07-19","locale":"en","plan":{"id":"preview-d8e7bffb76e814cf8fed232ed5817008d9291247f94d4e63bda6fbeb647daf33","version":2},"policy":{"id":"day-one-fraction-preview","version":3},"presentation":{"content":{"compilerVersion":"exercisebook-content-compiler/2","contentHash":"944225a2dda87ae6ee61e53f21a929301f5264793d665ea2200b65fb0f5a71dd","id":"math.fractions.add-unlike-denominators","revision":2,"sourceHash":"456c8908debd52c7fcc5eba6e2e9a38434b5fcd8343e7a14a427faae34502523"},"exercise":{"instruction":"Add each pair of fractions. Give every answer in lowest terms.","nodeId":"practice-01"},"lesson":{"nodeId":"lesson-explanation-01","paragraphs":["Find a denominator both fractions can use.","Rename each fraction without changing its value.","Add the numerators and keep the shared denominator."],"title":"The three moves"},"schema":"exercisebook.worksheet-presentation/v1","workedExample":{"model":{"commonDenominator":"6","left":{"denominator":"2","numerator":"1"},"leftScaledNumerator":"3","result":{"denominator":"6","numerator":"5"},"right":{"denominator":"3","numerator":"1"},"rightScaledNumerator":"2","type":"fraction-addition","unreducedSumNumerator":"5"},"nodeId":"worked-example-01","steps":["Find the least common denominator.","Rewrite both addends as equivalent fractions.","Add the numerators and reduce if needed."],"title":"One half plus one third"}},"rng":{"algorithm":"xoshiro128ss-v1","baseSeed":"338bee573add98fce96ae0616b008d002f1bb613bcbb805d6b291ce34bb1671f","seedSecretVersion":"public-preview-v2"},"schema":"exercisebook.worksheet-instance/v2","skillGraph":{"id":"phase-1-math","revision":1},"slots":[{"accessibility":{"summary":"Fraction addition problem: 1 over 4 plus 1 over 2."},"canonicalAnswer":{"type":"rational","value":{"denominator":"4","numerator":"3"}},"expectedMinutes":2,"hints":[{"id":"hint-common-denominator","text":"Find the least common multiple of 4 and 2."},{"id":"hint-equivalent-fractions","text":"Rewrite both addends as equivalent fractions with that denominator."}],"id":"practice-01","misconceptions":[{"description":"Adds both numerators and denominators.","id":"add-denominators","incorrectAnswer":{"denominator":"3","numerator":"1"}},{"description":"Adds the numerators without first finding a common denominator.","id":"keep-first-denominator","incorrectAnswer":{"denominator":"2","numerator":"1"}}],"printFallback":{"text":"Draw equal fraction bars for both addends, partition them into the least common denominator, then combine the shaded parts.","type":"text"},"prompt":{"accessibleText":"Add 1 over 4 and 1 over 2. Give the answer in lowest terms.","instruction":"Add each pair of fractions. Give every answer in lowest terms.","left":{"denominator":"4","numerator":"1"},"right":{"denominator":"2","numerator":"1"},"type":"fraction-addition"},"provenance":{"compilerVersion":"exercisebook-content-compiler/2","contentHash":"944225a2dda87ae6ee61e53f21a929301f5264793d665ea2200b65fb0f5a71dd","contentId":"math.fractions.add-unlike-denominators","contentRevision":2,"generationAttempt":0,"generatorId":"fractions.add","generatorVersion":"1","sourceHash":"456c8908debd52c7fcc5eba6e2e9a38434b5fcd8343e7a14a427faae34502523"},"scoringRule":{"accepted":{"denominator":"4","numerator":"3"},"requireReduced":true,"type":"rational-equals"},"selectionReasons":["current-frontier"],"skillIds":["math.fractions.add-unlike"],"slotSeed":"e8a6644ee32413686fe3c07217b45cac956dd669175164df731f5452b9c763e2","solutionTrace":[{"accessibleText":"The least common denominator is 4.","explanation":"Use 4 as the least common denominator.","expression":"\\operatorname{lcm}(4,2)=4","id":"find-common-denominator","kind":"common-denominator"},{"accessibleText":"1 over 4 equals 1 over 4.","explanation":"Rewrite the first addend with the common denominator.","expression":"\\frac{1}{4}=\\frac{1}{4}","id":"rewrite-left","kind":"rewrite-left","result":{"denominator":"4","numerator":"1"}},{"accessibleText":"1 over 2 equals 2 over 4.","explanation":"Rewrite the second addend with the common denominator.","expression":"\\frac{1}{2}=\\frac{2}{4}","id":"rewrite-right","kind":"rewrite-right","result":{"denominator":"2","numerator":"1"}},{"accessibleText":"1 plus 2 over 4 is 3 over 4.","explanation":"Add the numerators while keeping the common denominator.","expression":"\\frac{1+2}{4}=\\frac{3}{4}","id":"add-numerators","kind":"add-numerators","result":{"denominator":"4","numerator":"3"}},{"accessibleText":"3 over 4 is already in lowest terms.","explanation":"Check the fraction. It is already in lowest terms.","expression":"\\frac{3}{4}=\\frac{3}{4}","id":"reduce-answer","kind":"reduce","result":{"denominator":"4","numerator":"3"}}]},{"accessibility":{"summary":"Fraction addition problem: 1 over 4 plus 7 over 8."},"canonicalAnswer":{"type":"rational","value":{"denominator":"8","numerator":"9"}},"expectedMinutes":2,"hints":[{"id":"hint-common-denominator","text":"Find the least common multiple of 4 and 8."},{"id":"hint-equivalent-fractions","text":"Rewrite both addends as equivalent fractions with that denominator."}],"id":"practice-02","misconceptions":[{"description":"Adds both numerators and denominators.","id":"add-denominators","incorrectAnswer":{"denominator":"3","numerator":"2"}},{"description":"Adds the numerators without first finding a common denominator.","id":"keep-first-denominator","incorrectAnswer":{"denominator":"1","numerator":"2"}}],"printFallback":{"text":"Draw equal fraction bars for both addends, partition them into the least common denominator, then combine the shaded parts.","type":"text"},"prompt":{"accessibleText":"Add 1 over 4 and 7 over 8. Give the answer in lowest terms.","instruction":"Add each pair of fractions. Give every answer in lowest terms.","left":{"denominator":"4","numerator":"1"},"right":{"denominator":"8","numerator":"7"},"type":"fraction-addition"},"provenance":{"compilerVersion":"exercisebook-content-compiler/2","contentHash":"944225a2dda87ae6ee61e53f21a929301f5264793d665ea2200b65fb0f5a71dd","contentId":"math.fractions.add-unlike-denominators","contentRevision":2,"generationAttempt":0,"generatorId":"fractions.add","generatorVersion":"1","sourceHash":"456c8908debd52c7fcc5eba6e2e9a38434b5fcd8343e7a14a427faae34502523"},"scoringRule":{"accepted":{"denominator":"8","numerator":"9"},"requireReduced":true,"type":"rational-equals"},"selectionReasons":["current-frontier"],"skillIds":["math.fractions.add-unlike"],"slotSeed":"e6e1e8dd6d7035986111e807223708b6789a2be74c693311aeb40e74168d4381","solutionTrace":[{"accessibleText":"The least common denominator is 8.","explanation":"Use 8 as the least common denominator.","expression":"\\operatorname{lcm}(4,8)=8","id":"find-common-denominator","kind":"common-denominator"},{"accessibleText":"1 over 4 equals 2 over 8.","explanation":"Rewrite the first addend with the common denominator.","expression":"\\frac{1}{4}=\\frac{2}{8}","id":"rewrite-left","kind":"rewrite-left","result":{"denominator":"4","numerator":"1"}},{"accessibleText":"7 over 8 equals 7 over 8.","explanation":"Rewrite the second addend with the common denominator.","expression":"\\frac{7}{8}=\\frac{7}{8}","id":"rewrite-right","kind":"rewrite-right","result":{"denominator":"8","numerator":"7"}},{"accessibleText":"2 plus 7 over 8 is 9 over 8.","explanation":"Add the numerators while keeping the common denominator.","expression":"\\frac{2+7}{8}=\\frac{9}{8}","id":"add-numerators","kind":"add-numerators","result":{"denominator":"8","numerator":"9"}},{"accessibleText":"9 over 8 is already in lowest terms.","explanation":"Check the fraction. It is already in lowest terms.","expression":"\\frac{9}{8}=\\frac{9}{8}","id":"reduce-answer","kind":"reduce","result":{"denominator":"8","numerator":"9"}}]},{"accessibility":{"summary":"Fraction addition problem: 1 over 3 plus 1 over 4."},"canonicalAnswer":{"type":"rational","value":{"denominator":"12","numerator":"7"}},"expectedMinutes":2,"hints":[{"id":"hint-common-denominator","text":"Find the least common multiple of 3 and 4."},{"id":"hint-equivalent-fractions","text":"Rewrite both addends as equivalent fractions with that denominator."}],"id":"practice-03","misconceptions":[{"description":"Adds both numerators and denominators.","id":"add-denominators","incorrectAnswer":{"denominator":"7","numerator":"2"}},{"description":"Adds the numerators without first finding a common denominator.","id":"keep-first-denominator","incorrectAnswer":{"denominator":"3","numerator":"2"}}],"printFallback":{"text":"Draw equal fraction bars for both addends, partition them into the least common denominator, then combine the shaded parts.","type":"text"},"prompt":{"accessibleText":"Add 1 over 3 and 1 over 4. Give the answer in lowest terms.","instruction":"Add each pair of fractions. Give every answer in lowest terms.","left":{"denominator":"3","numerator":"1"},"right":{"denominator":"4","numerator":"1"},"type":"fraction-addition"},"provenance":{"compilerVersion":"exercisebook-content-compiler/2","contentHash":"944225a2dda87ae6ee61e53f21a929301f5264793d665ea2200b65fb0f5a71dd","contentId":"math.fractions.add-unlike-denominators","contentRevision":2,"generationAttempt":0,"